{"$schema":"https://json-schema.org/draft/2020-12/schema","title":"Feedback Event","type":"object","additionalProperties":false,"required":["schemaVersion","sourceEventId","channel","customerId","serviceEventId","rating","serviceCompleted"],"properties":{"schemaVersion":{"const":"1.0"},"sourceEventId":{"type":"string","minLength":1,"maxLength":128},"channel":{"enum":["email","sms","whatsapp","web"]},"customerId":{"type":"string","minLength":1},"serviceEventId":{"type":"string","minLength":1},"rating":{"type":"integer","minimum":1,"maximum":5},"message":{"type":"string","maxLength":10000},"consentToContact":{"type":"boolean"},"optedOutOfReviewInvites":{"type":"boolean"},"serviceCompleted":{"type":"boolean"},"receivedAt":{"type":"string","format":"date-time"},"metadata":{"type":"object","additionalProperties":{"type":["string","number","boolean"]}}}}
