{"schemaVersion":"1.0","sourceEventId":"survey-4001","channel":"email","customerId":"cust-42","serviceEventId":"service-9001","rating":5,"message":"Great service and professional team","consentToContact":true,"optedOutOfReviewInvites":false,"serviceCompleted":true,"receivedAt":"2026-08-19T08:00:00Z"}
